[{"mappingId":"0504029833a8026aedc3e69d8b181c645656da5fa6f0a25a41f831c08c8b5757","nativeTraceId":"10000","service":"auth","token":"journey-00000000000000000000000000000000"},{"mappingId":"8ab6ab61037fd9edcbd883f111834196a94eb8dfc13343b23c6aae8c3b52116d","nativeTraceId":"10001","service":"auth","token":"journey-00000000000000000000000000000001"},{"mappingId":"c6feb08962497587e9c655d4a9ac9ce75abd46e78c6eb3a34b3913ff8c1c15f0","nativeTraceId":"10002","service":"auth","token":"journey-00000000000000000000000000000002"},{"mappingId":"fc95489e3cbd5e84965ec65c86198f7b9e9baf2991ecb21a8d0017d61af368c5","nativeTraceId":"10003","service":"auth","token":"journey-00000000000000000000000000000003"},{"mappingId":"3d1f137fb78409646ee28def04dc91319f2fb66fe036d568075e7eca075367bb","nativeTraceId":"10004","service":"auth","token":"journey-00000000000000000000000000000004"},{"mappingId":"aaf1b95194c5fdc7bf283430c072240853818484c41f49a4709c70681412eb06","nativeTraceId":"10005","service":"auth","token":"journey-00000000000000000000000000000005"},{"mappingId":"f9f7fdabfbd6edc678bec94c59c8f33d33f1f8371c2e741c6ec1f6c602f5bcfa","nativeTraceId":"10006","service":"auth","token":"journey-00000000000000000000000000000006"},{"mappingId":"f5b574b91645e1d73f3db8fcee5b280d172aade6555230047e03ffd6a04b5367","nativeTraceId":"10007","service":"auth","token":"journey-00000000000000000000000000000007"},{"mappingId":"d7f7d8d0954ce910d527ff2a9a5af21fb0a0a98aad094d9a98722f4eff4a52fa","nativeTraceId":"10008","service":"auth","token":"journey-00000000000000000000000000000008"},{"mappingId":"38558b6e4d345b967752cdb6bd073b49e11ba0240c6146b4ee6e2b8634c088c7","nativeTraceId":"10009","service":"auth","token":"journey-00000000000000000000000000000009"},{"mappingId":"67f33ce9213aabf7540d40c341d53400d72af447db969235a8dc24956eaca91e","nativeTraceId":"10010","service":"auth","token":"journey-0000000000000000000000000000000a"},{"mappingId":"7b24b6b3fd3756109a9c2d436ed02bafd1818b60f40bf379eb69e4009e4d7804","nativeTraceId":"10011","service":"auth","token":"journey-0000000000000000000000000000000b"},{"mappingId":"cf47b450b2c02f54c4716ae51f12e66b0e714bfc6c2de41d419b515fc4b4ac09","nativeTraceId":"10012","service":"auth","token":"journey-0000000000000000000000000000000c"},{"mappingId":"a9c18474f9779decb8bb61703591c07e6db56453b918556879e1b4b333990e8c","nativeTraceId":"10013","service":"auth","token":"journey-0000000000000000000000000000000d"},{"mappingId":"bbd9d9d6ef81337e834d45cf6c8851ad04051d9ec78456232fbb9b1c46768a87","nativeTraceId":"10014","service":"auth","token":"journey-0000000000000000000000000000000e"},{"mappingId":"015880bb3ce0d73458c89512d074936b52b513d2af4a0aa06094ebeacdb772f1","nativeTraceId":"10015","service":"auth","token":"journey-0000000000000000000000000000000f"},{"mappingId":"3760bb1a0ad136701253431ebac2734cea75b3aa62621444d7d36558ffdeca13","nativeTraceId":"10016","service":"auth","token":"journey-00000000000000000000000000000010"},{"mappingId":"4372fb914a249a4a91eb302ad99391a3a73fdb54299cd815039219422bc3f958","nativeTraceId":"10017","service":"auth","token":"journey-00000000000000000000000000000011"},{"mappingId":"222d31f9c31263a03aa6cbdef11fa8ad7479c7f156054ad9b5b3918b1623121e","nativeTraceId":"10018","service":"auth","token":"journey-00000000000000000000000000000012"},{"mappingId":"145a08f20ae76e7968d1575390c9f5aa2120677170ced2bbb39c8bcfd5073605","nativeTraceId":"10019","service":"auth","token":"journey-00000000000000000000000000000013"},{"mappingId":"d48c29d778608cdc65690484e2c2507226560b27aa07c99c10ed4788136eee1e","nativeTraceId":"10020","service":"auth","token":"journey-00000000000000000000000000000014"},{"mappingId":"9ebec3b5085c22fc719c2560e277547ecd8737e30779ccbb56c03c6a7ce80778","nativeTraceId":"10021","service":"auth","token":"journey-00000000000000000000000000000015"},{"mappingId":"49e031017dadf8f8465f85d56ef4537aec33310c07c6197caac2956ced5035b1","nativeTraceId":"10022","service":"auth","token":"journey-00000000000000000000000000000016"},{"mappingId":"fbd05e26266562a4c86dd9971045d4a86fe169f0aadcaff845df724650bd1055","nativeTraceId":"10023","service":"auth","token":"journey-00000000000000000000000000000017"},{"mappingId":"0243fd65f3e1fea31c56f476184b6da5c28f8206224249f0e0aa5171b8ddfc88","nativeTraceId":"10024","service":"auth","token":"journey-00000000000000000000000000000018"},{"mappingId":"c45d43d2248ed25bc2fe6ca3d181085bcecb1129bdc232d00b97fe9afc54dfe4","nativeTraceId":"10025","service":"auth","token":"journey-00000000000000000000000000000019"},{"mappingId":"dbd697a3c6fd64396f78858729c73788d881fdfc528f6147b093b7ba79025653","nativeTraceId":"10026","service":"auth","token":"journey-0000000000000000000000000000001a"},{"mappingId":"8ddd12b4b742016d400d72ac737f3efb3f2ebcabfc9f166dafe1cddc6668e35b","nativeTraceId":"10027","service":"auth","token":"journey-0000000000000000000000000000001b"},{"mappingId":"2d2cbe501ad1a0db3ff3108c55001d94e33e933265c666d7d699b116988debda","nativeTraceId":"10028","service":"auth","token":"journey-0000000000000000000000000000001c"},{"mappingId":"5badfd317795f10a7aa3031789bf51875e69515106cf269b9653bc6b34b2d770","nativeTraceId":"10029","service":"auth","token":"journey-0000000000000000000000000000001d"},{"mappingId":"5844da8bf33f503292f433b190a6cc0bd315bf9a168fdd7042a666872014fff1","nativeTraceId":"10030","service":"auth","token":"journey-0000000000000000000000000000001e"},{"mappingId":"f9b88765950756fd1b96ef7bbf615c0c3b4acdec075111b8300a89e6feb80079","nativeTraceId":"10031","service":"auth","token":"journey-0000000000000000000000000000001f"},{"mappingId":"c436c5eeb736fca07eb8fcd6c2a7916d5dd585848964328c788b50989d0c6b67","nativeTraceId":"10032","service":"auth","token":"journey-00000000000000000000000000000020"},{"mappingId":"176ee4b01b7e398f1cb22b4d4c6b16e797153fa1697cbae92db34f47f6365fe0","nativeTraceId":"10033","service":"auth","token":"journey-00000000000000000000000000000021"},{"mappingId":"7709b3e5a0a9f110012a4fba64f1df3553f580e4a8bb06fd130dff1b365e8392","nativeTraceId":"10034","service":"auth","token":"journey-00000000000000000000000000000022"},{"mappingId":"a8699e7ba7dbe490ba363fb2e2213d8777645976171b222bc071204b3b52911f","nativeTraceId":"10035","service":"auth","token":"journey-00000000000000000000000000000023"}]
